{
  "profile": "bwg-worker-controller/0.2",
  "semanticProfile": "bwg-worker-controller/0.1",
  "transportProfile": "bwg-worker-usb/0.1",
  "updateAuthorityKeys": [
    {
      "crv": "Ed25519",
      "ext": true,
      "key_ops": ["verify"],
      "kty": "OKP",
      "x": "e0TEVTvtEFnGIXFqNF4oCubZiGlDhyYQIUdJNdqLJFs",
      "kid": "update-capability-fixture-02",
      "alg": "Ed25519",
      "use": "sig"
    }
  ],
  "capabilities": {
    "protocolVersion": "bwg-worker-controller/0.2",
    "board": {
      "model": "bitaxe-gamma",
      "revision": "204",
      "usbTransport": "web_usb"
    },
    "firmware": {
      "name": "bright-builds-reference-firmware",
      "version": "0.2.0"
    },
    "compatibility": {
      "referenceFirmware": true,
      "workLease": "supported",
      "miningBaselineRestoration": "supported",
      "settingsPreservation": "compatible"
    },
    "transportProfile": "bwg-worker-usb/0.1",
    "attestation": {
      "claims": {
        "profile": "bwg-reference-firmware-capability/0.1",
        "protocolVersion": "bwg-worker-controller/0.2",
        "board": {
          "model": "bitaxe-gamma",
          "revision": "204"
        },
        "firmware": {
          "name": "bright-builds-reference-firmware",
          "version": "0.2.0"
        },
        "compatibility": {
          "referenceFirmware": true,
          "workLease": "supported",
          "miningBaselineRestoration": "supported",
          "settingsPreservation": "compatible"
        },
        "transportProfile": "bwg-worker-usb/0.1",
        "applicationDescriptorSha256": "rOKO_7whZfy0ntMKM9RIeZNAA3x97tt3rWMAm_QshVA"
      },
      "compactJws": "eyJhbGciOiJFZDI1NTE5IiwidHlwIjoiYndnLXdvcmtlci1jYXBhYmlsaXR5K2p3cyIsImtpZCI6InVwZGF0ZS1jYXBhYmlsaXR5LWZpeHR1cmUtMDIifQ.eyJhcHBsaWNhdGlvbkRlc2NyaXB0b3JTaGEyNTYiOiJyT0tPXzd3aFpmeTBudE1LTTlSSWVaTkFBM3g5N3R0M3JXTUFtX1FzaFZBIiwiYm9hcmQiOnsibW9kZWwiOiJiaXRheGUtZ2FtbWEiLCJyZXZpc2lvbiI6IjIwNCJ9LCJjb21wYXRpYmlsaXR5Ijp7Im1pbmluZ0Jhc2VsaW5lUmVzdG9yYXRpb24iOiJzdXBwb3J0ZWQiLCJyZWZlcmVuY2VGaXJtd2FyZSI6dHJ1ZSwic2V0dGluZ3NQcmVzZXJ2YXRpb24iOiJjb21wYXRpYmxlIiwid29ya0xlYXNlIjoic3VwcG9ydGVkIn0sImZpcm13YXJlIjp7Im5hbWUiOiJicmlnaHQtYnVpbGRzLXJlZmVyZW5jZS1maXJtd2FyZSIsInZlcnNpb24iOiIwLjIuMCJ9LCJwcm9maWxlIjoiYndnLXJlZmVyZW5jZS1maXJtd2FyZS1jYXBhYmlsaXR5LzAuMSIsInByb3RvY29sVmVyc2lvbiI6ImJ3Zy13b3JrZXItY29udHJvbGxlci8wLjIiLCJ0cmFuc3BvcnRQcm9maWxlIjoiYndnLXdvcmtlci11c2IvMC4xIn0.1BcYp96FLKNTyH_W3k2M-WivspfGND1aX8zWmenO1pglVNVCVgVczukSBzlJWkvck1_xP1Q9WxIkYrfs7TPnAQ"
    }
  },
  "lease": {
    "protocolVersion": "bwg-worker-controller/0.2",
    "leaseId": "lease_fixture_02",
    "challengeId": "challenge_00000000000000000000000000000001",
    "authorization": "fixture-authentication-not-a-production-secret",
    "durationMilliseconds": 60000,
    "renewAfterMilliseconds": 20000,
    "stratum": {
      "endpoint": "stratum+tcp://127.0.0.1:3333/",
      "username": "fixture-session-user",
      "password": "fixture-session-password"
    }
  },
  "renewal": {
    "protocolVersion": "bwg-worker-controller/0.2",
    "leaseId": "lease_fixture_02",
    "authorization": "fixture-renewal-authentication",
    "durationMilliseconds": 60000,
    "renewAfterMilliseconds": 20000
  },
  "status": {
    "protocolVersion": "bwg-worker-controller/0.2",
    "state": "baseline",
    "monotonicMilliseconds": 0,
    "restoration": {
      "status": "not_required"
    }
  },
  "negativeTransfers": [
    { "id": "empty_transfer", "operation": "empty", "expectedError": "invalid_frame" },
    { "id": "oversized_transfer", "operation": "oversized", "expectedError": "invalid_frame" },
    { "id": "invalid_utf8_transfer", "operation": "invalid_utf8", "expectedError": "invalid_frame" },
    { "id": "invalid_json_transfer", "operation": "invalid_json", "expectedError": "invalid_frame" },
    { "id": "truncated_transfer", "operation": "missing_lf", "expectedError": "invalid_frame" },
    { "id": "multiple_transfer_frames", "operation": "multiple_frames", "expectedError": "invalid_frame" },
    { "id": "unknown_request_field", "operation": "unknown_request_field", "expectedError": "invalid_message" }
  ],
  "usbVectors": [
    {
      "id": "v02_discover",
      "request": {
        "protocolVersion": "bwg-worker-controller/0.2",
        "requestId": "usb_v02_discover",
        "command": "discover"
      },
      "response": {
        "protocolVersion": "bwg-worker-controller/0.2",
        "requestId": "usb_v02_discover",
        "ok": true,
        "result": {
          "protocolVersion": "bwg-worker-controller/0.2",
          "board": {
            "model": "bitaxe-gamma",
            "revision": "204",
            "usbTransport": "web_usb"
          },
          "firmware": {
            "name": "bright-builds-reference-firmware",
            "version": "0.2.0"
          },
          "compatibility": {
            "referenceFirmware": true,
            "workLease": "supported",
            "miningBaselineRestoration": "supported",
            "settingsPreservation": "compatible"
          },
          "transportProfile": "bwg-worker-usb/0.1",
          "attestation": {
            "claims": {
              "profile": "bwg-reference-firmware-capability/0.1",
              "protocolVersion": "bwg-worker-controller/0.2",
              "board": {
                "model": "bitaxe-gamma",
                "revision": "204"
              },
              "firmware": {
                "name": "bright-builds-reference-firmware",
                "version": "0.2.0"
              },
              "compatibility": {
                "referenceFirmware": true,
                "workLease": "supported",
                "miningBaselineRestoration": "supported",
                "settingsPreservation": "compatible"
              },
              "transportProfile": "bwg-worker-usb/0.1",
              "applicationDescriptorSha256": "rOKO_7whZfy0ntMKM9RIeZNAA3x97tt3rWMAm_QshVA"
            },
            "compactJws": "eyJhbGciOiJFZDI1NTE5IiwidHlwIjoiYndnLXdvcmtlci1jYXBhYmlsaXR5K2p3cyIsImtpZCI6InVwZGF0ZS1jYXBhYmlsaXR5LWZpeHR1cmUtMDIifQ.eyJhcHBsaWNhdGlvbkRlc2NyaXB0b3JTaGEyNTYiOiJyT0tPXzd3aFpmeTBudE1LTTlSSWVaTkFBM3g5N3R0M3JXTUFtX1FzaFZBIiwiYm9hcmQiOnsibW9kZWwiOiJiaXRheGUtZ2FtbWEiLCJyZXZpc2lvbiI6IjIwNCJ9LCJjb21wYXRpYmlsaXR5Ijp7Im1pbmluZ0Jhc2VsaW5lUmVzdG9yYXRpb24iOiJzdXBwb3J0ZWQiLCJyZWZlcmVuY2VGaXJtd2FyZSI6dHJ1ZSwic2V0dGluZ3NQcmVzZXJ2YXRpb24iOiJjb21wYXRpYmxlIiwid29ya0xlYXNlIjoic3VwcG9ydGVkIn0sImZpcm13YXJlIjp7Im5hbWUiOiJicmlnaHQtYnVpbGRzLXJlZmVyZW5jZS1maXJtd2FyZSIsInZlcnNpb24iOiIwLjIuMCJ9LCJwcm9maWxlIjoiYndnLXJlZmVyZW5jZS1maXJtd2FyZS1jYXBhYmlsaXR5LzAuMSIsInByb3RvY29sVmVyc2lvbiI6ImJ3Zy13b3JrZXItY29udHJvbGxlci8wLjIiLCJ0cmFuc3BvcnRQcm9maWxlIjoiYndnLXdvcmtlci11c2IvMC4xIn0.1BcYp96FLKNTyH_W3k2M-WivspfGND1aX8zWmenO1pglVNVCVgVczukSBzlJWkvck1_xP1Q9WxIkYrfs7TPnAQ"
          }
        }
      }
    },
    {
      "id": "v02_start",
      "request": {
        "protocolVersion": "bwg-worker-controller/0.2",
        "requestId": "usb_v02_start",
        "command": "start_lease",
        "payload": {
          "protocolVersion": "bwg-worker-controller/0.2",
          "leaseId": "lease_fixture_02",
          "challengeId": "challenge_00000000000000000000000000000001",
          "authorization": "fixture-authentication-not-a-production-secret",
          "durationMilliseconds": 60000,
          "renewAfterMilliseconds": 20000,
          "stratum": {
            "endpoint": "stratum+tcp://127.0.0.1:3333/",
            "username": "fixture-session-user",
            "password": "fixture-session-password"
          }
        }
      },
      "response": {
        "protocolVersion": "bwg-worker-controller/0.2",
        "requestId": "usb_v02_start",
        "ok": true,
        "result": {
          "protocolVersion": "bwg-worker-controller/0.2",
          "state": "mining",
          "monotonicMilliseconds": 0,
          "lease": {
            "leaseId": "lease_fixture_02",
            "challengeId": "challenge_00000000000000000000000000000001",
            "renewAtMonotonicMilliseconds": 20000,
            "expiresAtMonotonicMilliseconds": 60000
          },
          "restoration": {
            "status": "pending"
          }
        }
      }
    },
    {
      "id": "v02_renew",
      "request": {
        "protocolVersion": "bwg-worker-controller/0.2",
        "requestId": "usb_v02_renew",
        "command": "renew_lease",
        "payload": {
          "protocolVersion": "bwg-worker-controller/0.2",
          "leaseId": "lease_fixture_02",
          "authorization": "fixture-renewal-authentication",
          "durationMilliseconds": 60000,
          "renewAfterMilliseconds": 20000
        }
      },
      "response": {
        "protocolVersion": "bwg-worker-controller/0.2",
        "requestId": "usb_v02_renew",
        "ok": true,
        "result": {
          "protocolVersion": "bwg-worker-controller/0.2",
          "state": "mining",
          "monotonicMilliseconds": 10000,
          "lease": {
            "leaseId": "lease_fixture_02",
            "challengeId": "challenge_00000000000000000000000000000001",
            "renewAtMonotonicMilliseconds": 30000,
            "expiresAtMonotonicMilliseconds": 70000
          },
          "restoration": { "status": "pending" }
        }
      }
    },
    {
      "id": "v02_status",
      "request": {
        "protocolVersion": "bwg-worker-controller/0.2",
        "requestId": "usb_v02_status",
        "command": "status"
      },
      "response": {
        "protocolVersion": "bwg-worker-controller/0.2",
        "requestId": "usb_v02_status",
        "ok": true,
        "result": {
          "protocolVersion": "bwg-worker-controller/0.2",
          "state": "baseline",
          "monotonicMilliseconds": 0,
          "restoration": { "status": "not_required" }
        }
      }
    },
    {
      "id": "v02_pause",
      "request": {
        "protocolVersion": "bwg-worker-controller/0.2",